Setting environment for using XAMPP for Windows.
Anushka@DESKTOP-BHNQHBB c:\xampp
# mysql -u root
Welcome to the MariaDB monitor.  Commands end with ; or \g.
Your MariaDB connection id is 15
Server version: 10.4.11-MariaDB mariadb.org binary distribution

Copyright (c) 2000, 2018, Oracle, MariaDB Corporation Ab and others.

Type 'help;' or '\h' for help. Type '\c' to clear the current input statement.

MariaDB [(none)]> show databases
    -> ;
+--------------------+
| Database           |
+--------------------+
| bookshop           |
| car_rental_pokhara |
| collmgmtsys        |
| information_schema |
| medicalarchive     |
| mysql              |
| performance_schema |
| phpmyadmin         |
| test               |
| try                |
+--------------------+
10 rows in set (0.001 sec)

MariaDB [(none)]> create database gces;
Query OK, 1 row affected (0.006 sec)

MariaDB [(none)]> show databases;
+--------------------+
| Database           |
+--------------------+
| bookshop           |
| car_rental_pokhara |
| collmgmtsys        |
| gces               |
| information_schema |
| medicalarchive     |
| mysql              |
| performance_schema |
| phpmyadmin         |
| test               |
| try                |
+--------------------+
11 rows in set (0.001 sec)

MariaDB [(none)]> create table student(roll int , name varchar(15), marks int);
ERROR 2006 (HY000): MySQL server has gone away
No connection. Trying to reconnect...
Connection id:    16
Current database: *** NONE ***

ERROR 1046 (3D000): No database selected
MariaDB [(none)]> show databases;
+--------------------+
| Database           |
+--------------------+
| bookshop           |
| car_rental_pokhara |
| collmgmtsys        |
| gces               |
| information_schema |
| medicalarchive     |
| mysql              |
| performance_schema |
| phpmyadmin         |
| test               |
| try                |
+--------------------+
11 rows in set (0.004 sec)

MariaDB [(none)]> use gces;
Database changed
MariaDB [gces]> create table student(roll int , name varchar(15), marks int);
Query OK, 0 rows affected (0.081 sec)

MariaDB [gces]> insert into student(roll , name , marks) values(1 ,'Anushka', 40), (2,'Aiyana',50),(3,'Pratigya', 55);
Query OK, 3 rows affected (0.025 sec)
Records: 3  Duplicates: 0  Warnings: 0

MariaDB [gces]> desc student;
+-------+-------------+------+-----+---------+-------+
| Field | Type        | Null | Key | Default | Extra |
+-------+-------------+------+-----+---------+-------+
| roll  | int(11)     | YES  |     | NULL    |       |
| name  | varchar(15) | YES  |     | NULL    |       |
| marks | int(11)     | YES  |     | NULL    |       |
+-------+-------------+------+-----+---------+-------+
3 rows in set (0.059 sec)

MariaDB [gces]> select * from student;
+------+----------+-------+
| roll | name     | marks |
+------+----------+-------+
|    1 | Anushka  |    40 |
|    2 | Aiyana   |    50 |
|    3 | Pratigya |    55 |
+------+----------+-------+
3 rows in set (0.007 sec)

MariaDB [gces]> select avg(marks) from student;
+------------+
| avg(marks) |
+------------+
|    48.3333 |
+------------+
1 row in set (0.009 sec)

MariaDB [gces]> select roll, name from student;
+------+----------+
| roll | name     |
+------+----------+
|    1 | Anushka  |
|    2 | Aiyana   |
|    3 | Pratigya |
+------+----------+
3 rows in set (0.000 sec)

MariaDB [gces]> select max(marks) from student;
+------------+
| max(marks) |
+------------+
|         55 |
+------------+
1 row in set (0.006 sec)

MariaDB [gces]> select * from student order by name;
+------+----------+-------+
| roll | name     | marks |
+------+----------+-------+
|    2 | Aiyana   |    50 |
|    1 | Anushka  |    40 |
|    3 | Pratigya |    55 |
+------+----------+-------+
3 rows in set (0.007 sec)

MariaDB [gces]> select * from student order by name desc;
+------+----------+-------+
| roll | name     | marks |
+------+----------+-------+
|    3 | Pratigya |    55 |
|    1 | Anushka  |    40 |
|    2 | Aiyana   |    50 |
+------+----------+-------+
3 rows in set (0.000 sec)

MariaDB [gces]> select * from student order by marks desc;
+------+----------+-------+
| roll | name     | marks |
+------+----------+-------+
|    3 | Pratigya |    55 |
|    2 | Aiyana   |    50 |
|    1 | Anushka  |    40 |
+------+----------+-------+
3 rows in set (0.000 sec)

MariaDB [gces]> select * from student order by name, roll;
+------+----------+-------+
| roll | name     | marks |
+------+----------+-------+
|    2 | Aiyana   |    50 |
|    1 | Anushka  |    40 |
|    3 | Pratigya |    55 |
+------+----------+-------+
3 rows in set (0.001 sec)

MariaDB [gces]> select * from student order by name , roll desc;
+------+----------+-------+
| roll | name     | marks |
+------+----------+-------+
|    2 | Aiyana   |    50 |
|    1 | Anushka  |    40 |
|    3 | Pratigya |    55 |
+------+----------+-------+
3 rows in set (0.000 sec)

MariaDB [gces]> update student set roll = 4 where roll = 3;
Query OK, 1 row affected (0.009 sec)
Rows matched: 1  Changed: 1  Warnings: 0

MariaDB [gces]> select * from student;
+------+----------+-------+
| roll | name     | marks |
+------+----------+-------+
|    1 | Anushka  |    40 |
|    2 | Aiyana   |    50 |
|    4 | Pratigya |    55 |
+------+----------+-------+
3 rows in set (0.000 sec)

MariaDB [gces]> delete from student where roll = 2;
Query OK, 1 row affected (0.004 sec)

MariaDB [gces]> select* from student;
+------+----------+-------+
| roll | name     | marks |
+------+----------+-------+
|    1 | Anushka  |    40 |
|    4 | Pratigya |    55 |
+------+----------+-------+
2 rows in set (0.000 sec)

MariaDB [gces]> delete from student;
Query OK, 2 rows affected (0.007 sec)

MariaDB [gces]> select * student;
ERROR 1064 (42000): You have an error in your SQL syntax; check the manual that corresponds to your MariaDB server version for the right syntax to use near 'student' at line 1
MariaDB [gces]> show tables;
+----------------+
| Tables_in_gces |
+----------------+
| student        |
+----------------+
1 row in set (0.005 sec)

MariaDB [gces]> drop student;
ERROR 1064 (42000): You have an error in your SQL syntax; check the manual that corresponds to your MariaDB server version for the right syntax to use near 'student' at line 1
MariaDB [gces]> delete student;
ERROR 1064 (42000): You have an error in your SQL syntax; check the manual that corresponds to your MariaDB server version for the right syntax to use near '' at line 1
MariaDB [gces]>