Setting environment for using XAMPP for Windows.
Anushka@DESKTOP-BHNQHBB c:\xampp
# mysql -u root
Welcome to the MariaDB monitor.  Commands end with ; or \g.
Your MariaDB connection id is 22
Server version: 10.4.11-MariaDB mariadb.org binary distribution

Copyright (c) 2000, 2018, Oracle, MariaDB Corporation Ab and others.

Type 'help;' or '\h' for help. Type '\c' to clear the current input statement.

MariaDB [(none)]> use gces;
ERROR 1049 (42000): Unknown database 'gces'
MariaDB [(none)]> create database customers;
Query OK, 1 row affected (0.001 sec)

MariaDB [(none)]> use customers;
Database changed
MariaDB [customers]> create table customers (Id int primary key, Name varchar(4), Age int, Address varchar(4), Salary float);
Query OK, 0 rows affected (0.039 sec)

MariaDB [customers]> desc customers;
+---------+------------+------+-----+---------+-------+
| Field   | Type       | Null | Key | Default | Extra |
+---------+------------+------+-----+---------+-------+
| Id      | int(11)    | NO   | PRI | NULL    |       |
| Name    | varchar(4) | YES  |     | NULL    |       |
| Age     | int(11)    | YES  |     | NULL    |       |
| Address | varchar(4) | YES  |     | NULL    |       |
| Salary  | float      | YES  |     | NULL    |       |
+---------+------------+------+-----+---------+-------+
5 rows in set (0.053 sec)

MariaDB [customers]> insert into customers values( 1 , 'Ramesh' , 32 ,'Ahmedabad', 2000.00),(2, 'Khilan' , 25 ,'Delhi', 1500.00),(3,'Kaushik', 23,'Kota' , 2000.00), (4,'Chaitali',25,'Mumbai',6500.00),(5,'Hardik',27,'Bhopal',8500.00),(6,'Komal',22,'MP',4500.00),(7,'Muffy',24,'Indore',10000.00);
ERROR 2006 (HY000): MySQL server has gone away
No connection. Trying to reconnect...
Connection id:    23
Current database: customers

Query OK, 7 rows affected, 12 warnings (0.011 sec)
Records: 7  Duplicates: 0  Warnings: 12

MariaDB [customers]> select * from customers;
+----+------+------+---------+--------+
| Id | Name | Age  | Address | Salary |
+----+------+------+---------+--------+
|  1 | Rame |   32 | Ahme    |   2000 |
|  2 | Khil |   25 | Delh    |   1500 |
|  3 | Kaus |   23 | Kota    |   2000 |
|  4 | Chai |   25 | Mumb    |   6500 |
|  5 | Hard |   27 | Bhop    |   8500 |
|  6 | Koma |   22 | MP      |   4500 |
|  7 | Muff |   24 | Indo    |  10000 |
+----+------+------+---------+--------+
7 rows in set (0.005 sec)

MariaDB [customers]> create view customers_view as select name, age from customers;
Query OK, 0 rows affected (0.034 sec)

MariaDB [customers]> select* from customers_view;
+------+------+
| name | age  |
+------+------+
| Rame |   32 |
| Khil |   25 |
| Kaus |   23 |
| Chai |   25 |
| Hard |   27 |
| Koma |   22 |
| Muff |   24 |
+------+------+
7 rows in set (0.008 sec)

MariaDB [customers]> select name from customers_view where age = 25;
+------+
| name |
+------+
| Khil |
| Chai |
+------+
2 rows in set (0.001 sec)

MariaDB [customers]> ::: drop view <customers_view>;
ERROR 1064 (42000): You have an error in your SQL syntax; check the manual that corresponds to your MariaDB server version for the right syntax to use near '::: drop view <customers_view>' at line 1
MariaDB [customers]> drop view customers_view;
Query OK, 0 rows affected (0.001 sec)

MariaDB [customers]> select count(*) from customers where age = 25;
+----------+
| count(*) |
+----------+
|        2 |
+----------+
1 row in set (0.005 sec)

MariaDB [customers]> select count(*) from customers;
+----------+
| count(*) |
+----------+
|        7 |
+----------+
1 row in set (0.000 sec)

MariaDB [customers]> select min(age) from customers;
+----------+
| min(age) |
+----------+
|       22 |
+----------+
1 row in set (0.000 sec)

MariaDB [customers]> select max(age) from customers;
+----------+
| max(age) |
+----------+
|       32 |
+----------+
1 row in set (0.000 sec)

MariaDB [customers]> select avg(salary) from customers;
+-------------+
| avg(salary) |
+-------------+
|        5000 |
+-------------+
1 row in set (0.000 sec)

MariaDB [customers]> select sum(salary) from customers;
+-------------+
| sum(salary) |
+-------------+
|       35000 |
+-------------+
1 row in set (0.000 sec)

MariaDB [customers]> update customers set Name = 'Ramesh' where ID = 2;
Query OK, 1 row affected, 1 warning (0.007 sec)
Rows matched: 1  Changed: 1  Warnings: 1

MariaDB [customers]> update customers set Name = 'Kaushik' where ID = 4;
Query OK, 1 row affected, 1 warning (0.007 sec)
Rows matched: 1  Changed: 1  Warnings: 1

MariaDB [customers]> select * from customers;
+----+------+------+---------+--------+
| Id | Name | Age  | Address | Salary |
+----+------+------+---------+--------+
|  1 | Rame |   32 | Ahme    |   2000 |
|  2 | Rame |   25 | Delh    |   1500 |
|  3 | Kaus |   23 | Kota    |   2000 |
|  4 | Kaus |   25 | Mumb    |   6500 |
|  5 | Hard |   27 | Bhop    |   8500 |
|  6 | Koma |   22 | MP      |   4500 |
|  7 | Muff |   24 | Indo    |  10000 |
+----+------+------+---------+--------+
7 rows in set (0.001 sec)

MariaDB [customers]> select name , sum(salary) from customers;
+------+-------------+
| name | sum(salary) |
+------+-------------+
| Rame |       35000 |
+------+-------------+
1 row in set (0.001 sec)

MariaDB [customers]> select name, sum(salay) from customers group by name;
ERROR 1054 (42S22): Unknown column 'salay' in 'field list'
MariaDB [customers]> select name, sum(salary) from customers group by name;
+------+-------------+
| name | sum(salary) |
+------+-------------+
| Hard |        8500 |
| Kaus |        8500 |
| Koma |        4500 |
| Muff |       10000 |
| Rame |        3500 |
+------+-------------+
5 rows in set (0.002 sec)

MariaDB [customers]> select * from customers order by name desc, age acs;
ERROR 1064 (42000): You have an error in your SQL syntax; check the manual that corresponds to your MariaDB server version for the right syntax to use near 'acs' at line 1
MariaDB [customers]> select * from customers order by name desc, age;
+----+------+------+---------+--------+
| Id | Name | Age  | Address | Salary |
+----+------+------+---------+--------+
|  2 | Rame |   25 | Delh    |   1500 |
|  1 | Rame |   32 | Ahme    |   2000 |
|  7 | Muff |   24 | Indo    |  10000 |
|  6 | Koma |   22 | MP      |   4500 |
|  3 | Kaus |   23 | Kota    |   2000 |
|  4 | Kaus |   25 | Mumb    |   6500 |
|  5 | Hard |   27 | Bhop    |   8500 |
+----+------+------+---------+--------+
7 rows in set (0.000 sec)

MariaDB [customers]> select * from customers where address='Kota' or address = 'Mumbai' or address = 'Indore';
+----+------+------+---------+--------+
| Id | Name | Age  | Address | Salary |
+----+------+------+---------+--------+
|  3 | Kaus |   23 | Kota    |   2000 |
+----+------+------+---------+--------+
1 row in set (0.005 sec)

MariaDB [customers]> select * from customers where address in ('Kota','Mumbai','Indore');
+----+------+------+---------+--------+
| Id | Name | Age  | Address | Salary |
+----+------+------+---------+--------+
|  3 | Kaus |   23 | Kota    |   2000 |
+----+------+------+---------+--------+
1 row in set (0.002 sec)

MariaDB [customers]> select * from customers where id in(select id from customers where salary > 4500);
+----+------+------+---------+--------+
| Id | Name | Age  | Address | Salary |
+----+------+------+---------+--------+
|  4 | Kaus |   25 | Mumb    |   6500 |
|  5 | Hard |   27 | Bhop    |   8500 |
|  7 | Muff |   24 | Indo    |  10000 |
+----+------+------+---------+--------+
3 rows in set (0.007 sec)

MariaDB [customers]> update customers set salary = salary * 0.25 where age in (select age from customers where age >27);
Query OK, 1 row affected (0.005 sec)
Rows matched: 1  Changed: 1  Warnings: 0

MariaDB [customers]> select * from customers;
+----+------+------+---------+--------+
| Id | Name | Age  | Address | Salary |
+----+------+------+---------+--------+
|  1 | Rame |   32 | Ahme    |    500 |
|  2 | Rame |   25 | Delh    |   1500 |
|  3 | Kaus |   23 | Kota    |   2000 |
|  4 | Kaus |   25 | Mumb    |   6500 |
|  5 | Hard |   27 | Bhop    |   8500 |
|  6 | Koma |   22 | MP      |   4500 |
|  7 | Muff |   24 | Indo    |  10000 |
+----+------+------+---------+--------+
7 rows in set (0.000 sec)

MariaDB [customers]> select * from customers where address in ('Kota', 'Mumb', 'Indo');
+----+------+------+---------+--------+
| Id | Name | Age  | Address | Salary |
+----+------+------+---------+--------+
|  3 | Kaus |   23 | Kota    |   2000 |
|  4 | Kaus |   25 | Mumb    |   6500 |
|  7 | Muff |   24 | Indo    |  10000 |
+----+------+------+---------+--------+
3 rows in set (0.000 sec)

MariaDB [customers]> select * from customers where address='Kota' or address = 'Mumb' or address = 'Indo';
+----+------+------+---------+--------+
| Id | Name | Age  | Address | Salary |
+----+------+------+---------+--------+
|  3 | Kaus |   23 | Kota    |   2000 |
|  4 | Kaus |   25 | Mumb    |   6500 |
|  7 | Muff |   24 | Indo    |  10000 |
+----+------+------+---------+--------+
3 rows in set (0.000 sec)

MariaDB [customers]>